题目,作者,期刊,发表时间,摘要,关键词
社区慢性病主动预约健康管理模式对原发性高血压病的管理效果研究,杨梅;胡薇;江长勇,中国全科医学(2019年24期),2019/8/13,"背景慢性病已经成为威胁中国人健康的头号疾病,其造成的死亡人数占每年1030万死亡人数的80%。如果不加以控制,其治疗产生的直接成本和由于丧失劳动力、健康损失造成的经济成本会加重个人、企业政府的负担。目的研究慢性病主动预约健康管理模式对原发性高血压病的管理效果,推进家庭医生签约工作。方法2017年3月随机选取成都市武侯区晋阳社区卫生服务中心在管的450例签约原发性高血压病患者作为试验组;在武侯区其他家社区卫生服务中心采用分层抽样方法选取在管的签约原发性高血压病患者450例作为对照组。试验组针对不同病情分级分层患者制定相应主动预约健康管理干预方案,对照组按照《国家基本公共卫生服务规范(第三版)》高血压随访管理规范要求进行常规管理。干预期为2017年4月―2018年4月。采用自制的调查问卷通过前后及平行对照评估慢性病管理效果。调查问卷内容包括基本资料(性别、年龄、医保、文化程度、病程、并发症)、慢性病管理质量(血压控制率、慢性病近两周医疗费用)、患者满意度和医务人员工作效率(患者上午时段就诊率、门诊接诊平均耗时、近1个月内患者就诊次数)。结果试验组干预前血压控制率低于干预后,慢性病近两周医疗费用高于干预后,慢性病管理服务满意度、签约服务满意度低于干预后,患者上午时段就诊率、门诊接诊平均耗时及近1个月内患者就诊次数高于干预后(P<0.05);对照组干预前慢性病管理满意度、签约服务满意度低于干预后(P<0.05)。干预后试验组血压控制率高于对照组,患者上午时段就诊率及门诊接诊平均耗时低于对照组(P<0.05)。结论慢性病主动预约健康管理模式可提高血压控制率、患者满意度及医务人员工作效率,缩短门诊接诊平均耗时。",慢性病;社区卫生服务;全科医生;病人预约和时间安排;疾病管理;
中国医疗卫生资源供给水平的空间均衡状态及其时间演变,马志飞;尹上岗;乔文怡;李在军;吴启焰,地理科学(2018年06期),2018/6/15,"为正确认识医疗卫生资源空间分布的现状,以医疗卫生资源空间均衡状态及其时间演变趋势为研究内容,采用中国338个地级市为研究样本,运用核密度估计、基尼系数及其分解和LISA时间路径分析等方法,构建国家-区域-市域3个层次的空间均衡分析框架,定量刻画医疗卫生资源空间均衡状态及其时间演变特征。研究结果表明,医疗卫生资源的空间分布正在走向均衡;医疗卫生资源供给水平在三大区域之间的交错程度较高且呈现逐渐增高的趋势;在东部沿海到中部地区的过渡地带存在集中分布的低低集聚区,即医疗卫生资源供给水平同样存在""京汕低谷带""。",医疗卫生;空间均衡状态;时间演变;
县级公立医院改革的“政策突破”路径――以公立医院改革试点县A县为例,农圣;江蒙喜,中国医院管理(2017年07期),2017/7/5,"以公立医院改革试点县A县的改革成果和影响入手,分析改革经验和形成的机制,为县级公立医院改革提供参考。A县以""控费提质""为核心,以""政策性突破""替代""体制性突破""的做法具有现实可行性,但目前""被动控费、挤压收入""的行政性改革将对县域卫生行业长远发展和当地居民远期利益产生不良影响。",县级公立医院;改革;政策突破;一般路径;
深圳市社区健康服务整体管理调研评估与分析,饶昕,中国卫生经济(2017年06期),2017/6/5,"目的:调研评估深圳市社区健康服务整体管理水平,分析其影响因素,寻求相关启示,为卫生决策提供参考依据。方法:2016年组织了全市社区健康服务整体管理评估,由受调研单位统计上报。结果:共有590家社康中心、65家举办单位参加了全面评估,其中分层随机抽取60家社康中心、42家举办单位参加市级复核评估。结论:要做好社区健康服务的建设与发展,需要在政策环境、财政支持等方面继续保持和提升,包括政府对社区基本公共卫生服务和基本医疗服务经费支持、人员配置标准与经费支持、医保政策支持,社康在现有管理体制下,建立高效的社康运行机制,为居民提供方便、快捷的基本诊疗和基本公共卫生服务项目,解决居民基本健康需求。",社区卫生服务;管理与评价;深圳;
南宁市慢性病综合防控示范区建设成效与体会,黄建双,中国健康教育(2017年03期),2017/4/12 11:13,"慢性非传染性疾病综合防控示范区建设项目是当前我国防制慢性病及其危险因素的重大项目。广西南宁市构建了政府主导、多部门配合、全社会参与的工作模式,通过完善慢性病监测体系、加强慢性病防治网络建设、加强专业队伍建设等措施,结合基本公共卫生服务项目,大力开展了健康素养促进行动、全民健康生活方式行动等工作,有效推进了慢性非传染性疾病综合防控示范区建设。",慢性病;示范区;综合干预;健康促进;
一切为了百姓健康,,中国财政(2017年05期),2017/3/10,"<正>为提高百姓健康水平,""十二五""时期,国家卫生投入实现跨越式增长,全国财政医疗卫生(含计划生育)累计支出46499亿元,是""十一五""时期的2.7倍;年均增幅17.3%,比同期全国财政支出增幅高2.9个百分点。2016年,全国财政医疗卫生支出13154亿元(预算执行数),是医改启动前2008年的4.1倍,比2015年增长10%,比同期全国财政支出增幅高出3.2个百分点,医疗卫生支出占财政支出的比重提高到7.0%。",
海口市公立与民营社区卫生服务机构老年人、慢性病患者管理项目实施效果分析,朱庆;童已玲,现代预防医学(2017年03期),2017/2/10,"目的比较海口市公立与民营社区卫生服务机构老年人、慢性病患者管理项目实施效果,为制定卫生政策和区域卫生规划提供依据。方法以老年人健康管理率、规范管理率,慢病患者健康管理率、规范管理率和血压、血糖控制率为评价指标,应用描述性方法对海口市单位规模、辖区人口、老年人人数、慢病患者人数相似的34家公立与民营社区卫生服务机构2015年老年人、慢性病患者管理项目实施效果进行比较分析。结果海口市公立社区卫生服务机构老年人健康管理率为58.04%、规范管理率为92.06%;高血压患者健康管理率为33.32%、规范管理率为74.64%、血压控制率为63.08%;糖尿病患者健康管理率为23.34%、规范管理率为62.26%、血糖控制率为53.20%。民营社区卫生服务机构老年人健康管理率为51.62%、规范管理率为90.70%;高血压患者健康管理率为28.41%、规范管理率为67.29%、血压控制率为57.58%;糖尿病患者健康管理率为23.19%、规范管理率为67.76%、血糖控制率为49.19%。除糖尿病患者健康管理率、规范管理率外,各项指标比较公立社区卫生服务机构均高于民营社区卫生服务机构,差异有统计学意义(P<0.05)。结论海口市公立社区卫生服务机构老年人、慢性病患者管理项目实施效果优于民营社区卫生服务机构,政府应加大经费投入、政策扶持并完善监管制度,促进民营社区卫生服务机构更好地落实公共卫生服务功能。",社区卫生服务机构;老年人、慢性病患者管理;效果;分析;
江苏省乡村医生签约服务试点经验及启示,曹扬;汤苏川;任晓波;姜仑,中国卫生政策研究(2015年12期),2015/12/25,"本文简述了江苏乡村医生签约服务的实施背景、主要做法、推进措施,并从强化基本公共卫生服务公益性,提高乡村医生积极性,增加乡村医生收入待遇,均衡签约双方供需关系,引导建立农村分级诊疗制度和对新农合基金的影响等方面,对签约服务实施效果进行了分析。得出启示:以签约服务为切入点,重塑医患信任关系,改善乡村医生执业环境;围绕服务对象需求设计供给,明确基层首诊负责,建立合理就医秩序,有效提高资金使用效率;以健康管理为出发点,回归初级卫生保健本源,提升农村人群健康素质。",乡村医生;签约服务;分级诊疗;
十三五时期中国医疗卫生领域面临的问题及其治理,李蔚,甘肃社会科学(2015年06期),2015/12/2 9:49,"中国经济社会即将步入十三五规划时期,十三五是保障民生和建成小康社会的关键时期,更是全面落实国家治理体系与治理能力现代化的推进期。但是十三五时期医疗卫生领域面临的深层次的结构性矛盾和问题仍旧突出,如药品流通市场秩序混乱、公立医院的公益性弱化、医疗卫生资源过度集中于城市大医院、城乡基本公共卫生服务不均等。研究发现,政府在治理责任、治理能力和治理效率中存在一定缺失,应通过政府、市场和社会的协同治理规范药品流通秩序,提升国家和社会治理能力,保证公益性产出,国家治理与资源联动助推均衡配置,创新政府与社会的治理体制,推进基本公共卫生服务均等化。",十三五时期;医疗卫生;公益性;资源配置;服务均等化;国家治理能力;
北京市社区卫生服务项目成本测算模型构建,尹德卢;陈博文;程薇;王炜;刘钢;许俊峰;荣志清;崔明明;刘亚军;姜颖颖;赵丽颖;杨维中,中国卫生经济(2015年01期),2015/1/5,"目的:构建北京市社区卫生服务项目成本测算模型,测算北京市社区卫生服务项目成本。方法:通过文献查阅、专家研讨、现场观察等方法,构建北京市社区卫生服务项目分类及子项目,确定服务当量值;从北京市抽取17家服务功能健全、信息系统相对完善的社区卫生服务中心,利用其过去1年的支出情况和各服务项目服务量的信息,测算了1个标准服务当量的成本。结果:北京市主要的社区卫生服务项目分类共计5大类65项,分别是基本医疗服务项目23项、护理服务项目9项,药剂服务3项,辅助检查项目14项,公共卫生服务18项。以标准服务当量作为参照,急诊服务当量值为3.2,肌肉注射1.2,高血压患者管理服务当量值为8.5。1个标准服务当量的理论成本为11.80元,每服务人口基本公共卫生服务成本(不含药品)49.26元。结论:社区卫生服务项目成本城区和郊区有一定差异,主要表现在人力成本和材料成本;基本公共卫生服务项目补助严重不足;应建立成本测算动态管理机制。",社区卫生服务;成本测算;模型;当量法;北京;
农村地区老年人卫生服务利用情况及满意度,王蕾;崔颖,中国老年学杂志(2014年15期),2014/8/10,"目的了解农村地区老年人卫生服务利用情况及满意度。方法采用随机抽样的方法,对北京市郊区3个县203位老年人进行问卷调查。结果(1)不同医疗费用支出的老年人2w患病率存在显著差异。(2)不同性别和文化程度的老年人体检情况存在显著差异。(3)定期的慢性病筛查对老年人身体健康有积极影响。(4)文化程度、家庭经济状况、是否参加医疗保险是老年人卫生服务满意度的重要影响因素。结论(1)健全农村卫生服务体系,积极探索符合老年人特点的医疗服务模式。(2)利用多种形式加强针对老年人的健康教育。(3)慢性病管理是农村基本公共卫生服务的重点。(4)农村老年人卫生服务的满意度有待提高。",卫生服务利用;满意度;
中国城乡居民健康保障差异程度及其改善路径――基于镇江、东莞、成都、神木、银川的实证分析,翟绍果;仇雨临;马坤,经济管理(2014年01期),2014/1/15,"享有均等化健康保障是国民的基本权利,促进城乡健康公平是政府的重要责任。由于二元经济社会结构的制度隔阂,城乡居民健康保障在地域间、人群间差异明显。本文运用测量健康保障差异程度的李克特量表,对镇江、东莞、成都、神木、银川五地1198位城乡居民的调查显示,城乡居民健康保障差异程度比较显著,地域间差异大于人群间差异。基于调查数据的回归分析发现,城乡医疗服务差异是影响城乡健康保障差异程度的主要因素。因此,城乡居民健康保障改善路径在于,促进城乡基本医疗服务均等化,构建公共卫生、医疗服务、医疗保障和药品供应四位一体的健康管理服务系统。",城乡居民;健康保障;差异程度;改善路径;
上海某中心城区基本儿童保健服务利用现状研究,焦娜;梁霁;朱国伟;王克利;陈洪波;钱序,中国妇幼保健(2013年35期),2013/12/10,"目的:了解上海市某中心城区基本公共卫生服务中儿童保健服务利用现状,探讨提高基本儿童保健服务利用的措施。方法:采用定性研究与定量研究相结合的方法,对基本儿童保健服务政策制定者、实施管理者、服务提供者及服务对象母亲进行个人深入访谈,并对全区13个社区卫生服务中心调查期间内18个月2岁的儿童母亲进行问卷调查。结果:调查对象中儿童建卡率、自报规范体检率及1岁以内≥5次体检率分别为87.3%、84.8%及72.0%,其中上海市户籍儿童分别为93.7%、93.9%及87.4%,非该市户籍儿童分别为73.9%、73.1%及52.6%。影响基本儿童保健服务利用的因素,包括来自儿童家长、保健服务人员及体制机制等各个方面。结论:要缩小户籍与非户籍儿童基本保健服务政策知晓和服务利用上的差距,需要进一步加强基本儿童保健服务政策宣传,提高流动儿童家长保健意识,同时完善基层儿保人员激励机制。",儿童保健;基本公共卫生服务项目;服务利用;
影响健康教育服务均等化的社会因素研究,李侗桐;韩静;吴志军;方任飞;谢铮;简伟研,中国全科医学(2013年37期),2013/11/5,"目的了解北京市居民是否均等地接受社区卫生服务机构提供的健康教育服务,探讨影响健康教育服务均等化的社会因素。方法分层随机抽取北京市某区8家社区卫生服务中心,在每家社区卫生服务中心以偶遇抽样的方法抽取5090位居民作为调查对象。于2012年11月,采用自行设计的调查问卷进行调查,调查内容包括居民的社会人口学特征、是否接受健康教育、接受健康教育服务的类型、接受健康教育的满意度等。结合调查对象的社会人口学特征,利用回归分析方法分析户籍类型、就业状况、文化程度及收入水平等社会因素对均等地获取健康教育服务的影响。结果共发放问卷637份,有效回收问卷633份,有效回收率为99.4%。在633名社区居民中,共有342人（占54.0%）在社区接受过健康教育服务,从接受健康教育服务的类型上看,以健康生活方式为主（305人,占48.2%）。控制年龄、性别、离社区卫生服务机构的距离等因素后,本地城镇户籍人群接受社区健康教育服务的比例为非本地户籍者的1.880倍,离退休人员接受健康教育服务的比例为无业或失业人员的1.998倍,差异有统计学意义（P<0.05）。不同户籍类型、就业状况、文化程度、家庭人均月收入水平的社区居民对健康教育服务的满意度比较,差异均无统计学意义（P>0.05）。结论社区健康教育服务均等化水平已初步提高,户籍类型和就业状况是影响健康教育服务均等化的重要因素。",社区卫生服务;健康教育;均等化;社会因素;
全民医保与公共卫生服务体系,邓大松;赵奕钧,湖南社会科学(2012年06期),2012/11/28,"健全公共卫生服务体系是新医改的工作重点之一,它的发展直接与全民医保制度的覆盖范围、实施效果及其保障水平息息相关。各级政府正在实施基本公共卫生服务项目和重大公共卫生服务项目,且逐步提升公共卫生服务和突发事件卫生应急处置能力,这为实现基本公共卫生服务均等化目标,完善公共卫生服务体系具有不可或缺的作用。如果忽略公共卫生服务体系建设,不但全民医保目标难以实现,我国卫生事业战略发展更会陷入僵局。",全民医保;公共卫生服务体系;均等化;
加快推进以改善民生为重点的社会建设,张学兵,中共党史研究(2012年09期),2012/9/15,"<正>中共十七大以来,党和政府在促进国民经济又好又快发展的同时,以改善民生为重点,加快推进社会建设,努力使全体人民学有所教、劳有所得、病有所医、老有所养。几年来,教育、就业、社保、医疗等各项社会事业取得了一系列新进展。一、教育事业优先发展,教育公平迈出重大步伐中共十七大以来,党和政府坚持教育的公益性质,始终把教育摆在优先发展的位置。在财政支持和政策引导下,各级各类教育蓬勃发",
视窗,,中国全科医学(2011年22期),2011/8/5,"<正>温家宝主持召开国务院常务会议决定建立全科医生制度全科医生――发展中期待认同国务院医改办公室主任孙志刚谈建立全科医生制度全科医生制度需要免费医疗支撑温家宝主持召开国务院常务会议决定建立全科医生制度2011年6月22日,国务院总理温家",
开展绩效考评  提高社会保障资金使用效益,,中国财政(2011年01期),2011/1/5,"吉林省以建立跟踪问效机制为重点,探索性地开展了社会保障专项资金绩效考评工作,推动社会保障资金向科学化、精细化管理目标迈进。",
视窗,,中国全科医学(2011年01期),2011/1/5,<正>2011年第1期本期要目中国农村卫生发展项目基本公共卫生服务均等化经验交流暨高层研讨会在郑州召开专家称全科医生制度推广最适合中国情况国务院医改办公室负责人就建立规范基本药物采购机制发布答记者问,
构建覆盖“全域成都”的新型医疗卫生体制,,中国财政(2010年24期),2010/12/20,"<正>2009年,四川省成都市出台了《深化医药卫生体制改革总体方案》,提出到2011年,达到基本医疗保障制度全覆盖,基本公共卫生服务均等化,""全域成都""的基本医疗卫生服务体系不断完善,建立起与国家基本药物制度相适应的药品供应保障体系,公立医院改革试点和多元化办医取得突破,有效缓解城乡居民""看病难、看病贵"",实现人人享有基本医疗卫生服务。",
当前疾病预防控制体系存在的问题、形势与对策――以重庆市的疾病预防控制体系为例,张燕;幸奠国;王星月;舒明蓉;钟晓妮,中国卫生事业管理(2009年10期),2009/10/20,"疾病预防控制机构(以下简称疾控机构)是履行政府疾病预防控制职能、保障公众健康的专职公共卫生机构。近年来,全国疾控体系建设取得了显著成效,但目前仍存在一些亟待解决的问题。文章以重庆市疾病预防控制体系为例,分析了当前疾病预防控制体系存在的四大问题和面临的三大形势,反映出提高疾病预防控制体系能力建设的必要性和紧迫性,并有针对性的提出了四项对策,即疾控体系实施参照公务员法管理、制定疾控机构编制标准、实施收支两条线管理、建立新的工作运行机制。",疾病预防控制体系;问题;形势;对策;
财经要闻,,财会研究(2009年14期),2009/7/5,"<正>中国将在2012年前全面推进省直管县财政改革财政部9日发布关于推进省直接管理县财政改革的意见称,2012年底前,力争全国除民族自治地区外全面推进省直接管理县财政改革,近期首先将粮食、油料、棉花、生猪生产大县全部纳入改革范围。☆6月份财政收支情况:全国财政收入同比增长19.6%",
社区骨关节炎管理现状和策略的系统综述,刘茜;张含之;邱梦思;于德华,中国全科医学(2022年25期),2022/7/27,背景骨关节炎是中老年人常见的慢性病，严重影响中老年人的生活质量。在社区开展骨关节炎的疾病管理有利于资源配置的优化和提高疾病的整体防治水平，但目前骨关节炎的管理存在诸多问题，效果不佳。目的分析目前国内外社区骨关节炎的管理情况和策略进展，比较其优缺点，为我国社区骨关节炎管理提供更为优化的策略，以改善骨关节炎患者的诊疗效果和预后。方法于2020年10月至2021年1月，在中国知网、万方数据知识服务平台、维普网数据库主题检索“骨关节炎”与“管理”、“骨关节炎”与“模式”、“骨关节炎”与“策略”，在Pubmed、WebofScience、CochraneLibrary数据库主题检索("Osteoarthritis")AND("Management"OR"Mode"OR"Strategy")获得发表时间为2010-01-01至2020-01-01的文献。剔除重复及涉及骨关节炎自我管理的文献，对入选涉及社区骨关节炎管理的文献进行系统分析。结果检索到文献2695篇，删除2642篇，入选53篇涉及社区骨关节炎管理的文献。其中5篇文献涉及社区骨关节炎管理现况调查，均提及目前国内外对骨关节炎的管理缺乏协调性和目的性，同时治疗的重点是缓解症状、延缓软骨退化、减少畸形的发生，但疗效不能令人满意，且症状常反复发作；而且我国骨关节炎管理多停留在健康教育层面，管理模式单一。6篇文献内容涉及社区骨关节炎管理影响因素，结果提示目前患者及其家属对骨关节炎的认知不足，基层医院部分医生对骨关节炎认识不足、重视程度不够，医疗资源配置不协调，多种因素导致社区骨关节炎管理缺乏协调性和目的性。3篇文献内容涉及社区骨关节炎管理的意义，主要强调通过社区骨关节炎管理减轻患者疼痛、延缓疾病进展，从而改善患者生活质量、提高患者和医疗保健专业人员的满意度、优化医疗保健资源的使用。39篇文献内容涉及社区骨关节炎管理策略，其中22篇涉及系统性管理策略，包括社区骨关节炎多学科或综合管理模式(18篇)、社区骨关节炎分级管理(4篇)，整体来说社区骨关节炎管理策略借鉴了我国社区管理糖尿病及高血压的成功经验，但策略大多处于建设阶段，在实践中的应用尚需进一步研究；其余17篇涉及各种非系统性社区骨关节炎管理策略，其中8篇是以健康教育为主要方式的管理模式，3篇管理模式涉及网络模式，各有2篇涉及远程电话管理、非药物管理、书面信息指南。结论社区骨关节炎的管理策略中存在诸多问题，包括管治不协调、方法不健全、制度不完善。未来对骨关节炎患者进行管理可借鉴的策略包括：社区多学科或综合管理、分级管理等系统性的管理策略；充分利用医疗服务技术和工具，如电子医疗、网络远程管理、健康手册等；优化资源配置，如将骨关节炎健康管理纳入国家基本公共卫生服务项目，加大政府对骨关节炎管理的政策扶持。,骨关节炎;社区卫生服务;疾病管理;信息技术;系统综述;
我国3省居民参与基层健康教育的现状研究,杨思琪;尤莉莉;姜中石;樊子暄;刘远立,中国健康教育(2022年06期),2022/6/20,"目的了解居民对基层健康教育的利用情况与满意程度，为进一步完善基层健康教育的开展、促进基本公共卫生服务均等化提供借鉴。方法采用方便抽样方法，选取我国东中西部各1个省份(浙江省、山西省、重庆市),对在基层医疗卫生机构就诊的居民共10213人进行基层健康教育参与情况、参与方式与满意度调查。结果居民健康教育参与率为87.9%(95%CI:87.3%～88.5%),重庆市(73.0%)、社区卫生服务中心(84.1%)、家庭人均月收入≤2000元(86.3%)的居民参与率明显较低(P<0.001);有64.4%的孕产妇期望以网络推送的方式接受健康教育，但其有66.9%实际是以印刷资料的方式接受健康教育；有69.5%的65岁及以上非高血压/糖尿病老年人期望以健康知识讲座的方式接受健康教育，但其有66.0%是以健康教育宣传栏的方式接受健康教育；居民对基层健康教育的满意率为77.2%(95%CI:76.4%～78.0%),重庆市满意率(71.8%)明显较低(P<0.001),家庭人均月收入>10000元的居民满意率(83.2%)明显较高(P<0.001)。结论目前居民健康教育参与程度处于较高水平，但满意程度有待提高，居民实际参与健康教育方式与期望方式存在较大差异，基层提供的健康教育仍需进一步改善。",基层;健康教育;参与;满意;
