题目,作者,期刊,发表时间,摘要,关键词
成都基层医疗卫生机构基本公共卫生服务现况分析,梁娴;曾伟;魏咏兰;巫霞;代光智;鹿茸;张晓燕;郑柯;程雨,中国公共卫生(2012年01期),2012/1/15,"<正>公共卫生服务为改善、保护和促进全体人民健康是由政府出资、各级卫生部门和医疗卫生服务机构提供的卫生产品和卫生服务〔1〕。基本公共服务均等化就是要使每个公民都可以享受到均等化、普遍化、一体化的基本公共服务〔2〕。为全面了解四川省成都市不同地区机构基本公共卫生服务发展现况,由成都预防医学会组织市疾病预防控制中心、卫生执法",基本公共卫生服务;均等化;现况调查;
广州市基本公共卫生服务均等化评价指标体系的建立,练惠敏;胡正路,中国卫生事业管理(2012年01期),2012/1/15,"目的:建立一套科学的能较好反映广州市基本公共卫生服务均等化现状的评价指标体系。方法采用2轮Delphi专家咨询,根据指标重要性得分的均值和变异系数的大小筛选指标,并确定权重。结果2轮咨询专家应答率均超过90%,平均权威系数为(0.78±0.03)和(0.80±0.03);协调系数为0.23和0.37,第2轮差异有统计学意义(χ2=47.49,P<0.05)。经2轮咨询从47个备选指标中筛选出23个指标,指标权重系数介于0.0396和0.0479之间。结论:建立的广州市基本公共卫生服务均等化评价指标体系结构合理、针对性强,可用于评价广州市基本公共卫生服务均等化的现状。",基本公共卫生服务;均等化;评价指标体系;德尔菲法;
县级基本公共卫生服务项目质量监督与控制模式研究,何莎莎;王晓华;冯占春,中国卫生经济(2012年01期),2012/1/5,"卫生项目质量是项目执行与管理的生命线。文章以县级基本公共卫生服务项目为典型,通过对东部地区的江苏丹阳、中部地区的河南息县和西部地区的重庆九龙坡等县级项目的运行与质量管理现状进行调查,分析总结了项目质量监督与控制的主要方法。并结合相关理论与实践,初步构建了项目质量监督与控制模式。",基本公共卫生服务;县级;项目管理;
基于成本分析的成都市城乡基本公共卫生服务政策建议,景琳;杨练;杨小广;何军;范盟;张雪莉;丁富军;张媚;杨跃林;秦丽霞,中国卫生事业管理(2011年12期),2011/12/15,"目的:对成都市基层医疗卫生机构基本公共卫生服务项目进行成本测定,旨在为政府财政补助提供科学依据,为机构提高服务效率提供参考。对象:成都市社区卫生服务中心和乡镇卫生院样本机构共30所;方法:问卷调查法、观察法、时间系数分摊法;结果:各级政府财政对基本公共卫生服务项目人均补偿经费低于标准成本和实际成本;政策建议:机构应提高工作效率,政府适当增加财政补助,成本测算结果提示不宜增加基本公共卫生服务项目。",基本公共卫生服务;成本测算;财政补助;
社区卫生服务机构基本公共卫生服务能力分析,李善鹏;林永峰;徐凌忠,中国公共卫生(2011年12期),2011/12/15,"<正>中国2009年启动的基本公共卫生服务项目主要通过城市社区卫生服务中心(站)、乡镇卫生院、村卫生室等免费为居民提供,社区卫生服务机构成为基本公共卫生服务的网底〔1〕。山东省青岛市自2009年10月开始根据国家医改要求,按照人均15元的标准向社区居民提供9项基本公共卫生服务,然而机构资源配置、人员素质与服务效果密切相关〔2〕,服务能力能否达到政府所购买服务的标准,将直接影响到居民是否能获得高质量的服务以及医改的顺利实施。因此,于",社区卫生机构;公共卫生;服务能力;
甘肃省甘谷县基本公共卫生服务成本测算的研究,闫宣辰;丁国武;杨敬宇,重庆医学(2011年34期),2011/12/10,"目的促进甘谷县基本公共卫生服务的均等化,为卫Ⅺ项目的实施提供理论支持和实践经验。方法采用收支平衡法、结构式访谈法,并查阅相关机构数据和文献,把定量研究与定性研究相结合,分析甘谷县卫生机构经营的现状,并分析该县进行公共卫生服务成本测算困难的原因。结果甘谷县进行公共卫生服务成本测算的基础条件薄弱,面临着较多的特殊性问题,存在较多影响测算结果准确性的因素。结论调整成本测算要素,建立成本中心,进行成本归集,以满足当地居民不断增长的卫生服务需求。",公共卫生工作;成本及成本分析;因素分析;
实施“基本公共卫生服务项目”  推动妇幼保健工作发展,冷岚,中国妇幼保健(2011年34期),2011/12/1,"目的:了解重庆市南川区实施""基本公共卫生服务项目""对孕产妇、儿童系统管理,提高妇女儿童健康水平,降低孕产妇、5岁以下儿童死亡率的作用。方法:回顾性分析2008～2010重庆市南川区孕产妇、5岁以下儿童和婴儿死亡率从2008年的26.60/10万、16.73‰、7.83‰,降至2010年的12.48/10万、5.79‰、4.57‰,低出生体重发生率、5岁以下中重度营养不良患病率城镇、乡村明显下降。结论:实施""基本公共卫生服务项目""对重庆市南川区孕产妇、0～6岁儿童保健覆盖率有明显提高,孕产妇、5岁以下儿童死亡率成效显著。",基本公共卫生服务项目;妇幼保健工作;妇女儿童健康;
社区基本公共卫生服务按绩效支付的成本因素探讨,万美霞;陈永年,中国全科医学(2011年31期),2011/11/5,"目的探索解决对基层医疗卫生机构承担的公共卫生服务按绩效支付的具体方法。方法对于每一类公共卫生服务,借鉴作业成本法的思想,按照4个步骤测算成本。结果归纳出9类基本公共卫生服务的年成本和平均每位服务对象的成本测算公式,并举例说明其应用。结论建议政府机构可以用每位服务对象的成本乘以实际提供的服务量,再乘以该服务的质量调整系数和满意度调整系数,作为该服务的考核及拨款依据。",社区;公共卫生服务;绩效;成本;
基本公共卫生服务供给方激励问题的博弈分析,齐英;樊立华;毛静馥,中国卫生经济(2011年11期),2011/11/5,"在基本公共卫生服务""当年预拨、次年结算""的资金补偿制度下,基于政府和基层医疗卫生机构间的委托代理关系,运用博弈论分析完全信息条件下双方激励-努力动态博弈均衡,对机构努力程度和政府资金拨付方式进行了分析,力图为基本公共卫生服务激励机制的设计提供一种可供借鉴的思路。",基本公共卫生服务;补偿;委托代理;博弈;
中国社区护士培训方法研究,杨玲;杜雪平;王永利;苏秀玉,中国全科医学(2011年31期),2011/11/5,"目的结合中国社区护士培训现状和慢性病患者社区护理服务需求开展社区护理师资培训,探索研究社区护士培训方法,为逐级开展社区护士培训提供参考意见。方法在9个市的10个社区护理培训基地内,采用整体抽样的方法选取社区护士268人进行社区护理培训现状调查;采用完全随机的方法选取高血压患者274人、糖尿病患者331人进行慢性病患者社区护理服务需求调查;结合社区护理培训现状和慢性病患者社区护理服务需求,采用目的性抽样的方法选取社区护士及其合作护理学院教师共43名师资,对其进行社区护理理论与实践知识培训,利用培训前后理论考核、总体满意度及教师满意度调查、访谈等方法评价培训效果。结果社区护士和慢性病患者在基本公共卫生服务等方面有着一致的需求,结合两者需求开展社区护理师资培训,理论摸底考试成绩70分及以下者36人(占85.72%),结业考试成绩70分以上者37人(占88.10%),总体满意度各项评分>9分(总分10分),教师满意度各项评分>9分(总分10分)。结论绝大多数社区护士对社区护理培训有需求,与社区慢性病患者护理需求一致,应结合两者需求对社区护士进行培训。经过社区护理师资培训,社区护理师资理论水平得到提高,培训总体满意度和教师满意度评分较高,反馈较好,总体培训效果较理想。",社区护士;培训需求;培训方法;
税收与基本公共卫生服务均等化:基于福建省的研究,邓剑伟,中共福建省委党校学报(2011年10期),2011/10/10,"实现基本公共卫生服务均等化,保障城乡居民获得最基本、最有效的基本公共卫生服务,是服务型政府建设的重要内容。基本公共卫生服务作为纯公共物品,是市场不愿意或不能供给的,需要政府在其中发挥主导作用,而政府基本公共卫生服务职能的履行,需要有充足的财政收入作为保障。结合福建省的实际情况,分析不同区域、人群等维度的税收与基本公共服务均化现状,有助于揭示隐藏在背后的税制问题,并基于税收的角度提出改善福建省基本公共卫生服务均等化现状的对策建议。",税收;公共卫生服务;均等化;实证分析;
基本公共卫生服务均等化有关问题研究,,财政监督(2011年28期),2011/10/5,"<正>党的十七大报告中明确提出:""缩小区域发展差距,必须注重实现基本公共服务均等化,引导生产要素跨区域合理流动。""这是中国共产党的政治报告中第一次明确提出""基本公共服务均等化""概念。《中共中央、国务院关于深化医药卫生体制改革的意见》(中发[2009]6号)中明确指出:""促进基本",
农村基本公共卫生服务均等化实践探索――四川省荣县实施工作浅析,周世熙;王明德;夏和珍;邓富亨;毕可琪,中国卫生事业管理(2011年08期),2011/8/15,"对""农村基本公共卫生服务均等化""实施工作进行探索。选择示范乡镇开展相关工作,建立了项目目标年度考核、县乡两级督查和指导及资金划拨、绩效考核等管理制度。五个示范镇经过试运行,取得部分成效和经验,也存在一些问题,针对实际问题进行了进一步的探讨。",农村;基本公共卫生服务实施工作;实践;探索;
基本公共卫生服务中医药服务项目试点工作启动,,中国药房(2011年30期),2011/8/10,"<正>本刊讯2011年7月12日,国家中医药管理局在浙江省杭州市召开基本公共卫生服务中医药服务项目试点工作启动会。这标志着从即日起,将有多达73个市辖区(县)的社区居民可以在家门口享受到免费的中医药基本公共卫生服务。",
城乡基本公共卫生服务非均等化成因分析――一个公共支出的视角,尹栾玉;田苗苗,学术交流(2011年08期),2011/8/5,"在经济学的语境下,基本公共卫生服务是一种典型的公共产品,主要应该由政府来提供。改革开放后,由于过度强调医改过程中的市场化原则,政府在公共卫生服务领域严重缺位,直接导致了中国基本公共卫生服务的非均等化问题。公共卫生支出总量的不足和支出结构不合理,是造成城乡基本公共卫生服务非均等化的直接原因,解决这一问题要求政府必须打破二元经济结构的历史局限性,完善公共财政体制和转移支付制度,从而保证农村居民也能够平等地享受到公共卫生服务的基本权利。",基本公共卫生服务;公共支出;非均等化;
基本公共卫生服务均等化的难点与对策,陈丽;舒展;姚岚,中国卫生经济(2011年08期),2011/8/5,"作为当前深化医药卫生体制改革的一项重要制度安排和新医改五项工作重点之一,促进基本公共卫生服务逐步均等化对人民群众享有安全、有效、方便、价廉的医疗卫生服务具有重要意义。然而,各地在落实基本公共卫生服务均等化的过程中遇到了相关体制不完善、法律法规不健全、基层公共卫生服务提供体系不完善等一系列的障碍,文章针对这些问题展开分析并提出相关建议。",基本公共卫生服务;均等化;政策建议;
基本公共卫生服务均等化评估框架设计与构建,吴建;张亮;赵要军;张萌;谢双保,中国卫生经济(2011年08期),2011/8/5,"结合目前国家开展基本公共卫生服务均等化改革的实际需要,重点介绍了开展均等化评估的理念和思路,提出了结构化的评估框架,并经过专家咨询,建立了初步的评价指标体系,为下一步开展现场评估奠定了基础。",基本公共卫生服务;均等化;评估;设计;
广东省社区卫生服务中心业务开展情况的调查分析,刘莎娜;方小衡;刘海平;黄文杰;陈带娣;林志宽;范哲超,中国全科医学(2011年22期),2011/8/5,"目的了解广东省社区卫生服务中心的业务开展情况,为发展社区卫生服务提供参考依据。方法调查2009年广东省社区卫生服务中心诊疗服务和基本公共卫生服务的开展情况,并对不同区域间的差异进行分析。结果在诊疗服务方面,全省社区卫生服务中心总诊疗服务量为5088.37万人次;珠三角所均总诊疗人次最高,为14.63万人次,西翼最低,为1.51万人次。在基本公共卫生服务方面,全省社区卫生服务中心传染病报告率最高,达98.3%,重性精神疾病患者管理率最低,仅为7.1%;珠三角健康档案管理率最高,为11.1%,东翼最低,为4.1%;珠三角健康教育服务、慢性病患者管理服务开展得最好,东翼最差。结论广东省社区卫生服务初显成效,但不同区域的社区卫生服务开展水平间存在较大差异,双向转诊服务落实不到位。",社区卫生服务中心;诊疗服务;基本公共卫生服务;
实施国家基本公共卫生服务项目  促进基本公共卫生服务逐步均等化,,中国药房(2011年24期),2011/6/22,"<正>本刊讯实施国家基本公共卫生服务项目,是促进基本公共卫生服务逐步均等化的重要内容,是深化医药卫生体制改革近期重点任务。为城乡居民免费提供基本公共卫生服务,是我国政府坚持以人为本、落实预防为主卫生工作方针的具体体现,也是我国公共卫生领域的一项长期的、基础性的制度安排。通过对城乡居民健康问题进行干预,减少主要健康危险因素,有利于预防和控制传染病及慢性病的蔓延,有利于提高居民对公共卫生服务的可及性,逐步缩小城乡、地区和人群之间的差距,使城乡居民逐步享有均等化的基本公共卫生",
促进基本公共卫生服务均等化的现实困境及对策,余苏珍;王力;王素珍;王军永,中国卫生事业管理(2011年06期),2011/6/15,"基本公共卫生服务均等化是新医改方案明确提出的重点工作之一。本文主要从对基本公共卫生服务均等化内涵的理解入手,分析我国基本卫生服务均等化面对的困境及为逐步促进均等化所应采取的一系列政策措施。",基本公共卫生服务;均等化;医疗改革;
论国家基本公共卫生服务的政府责任,宁博;李士雪,中国卫生事业管理(2011年06期),2011/6/15,"文章在国家基本公共卫生服务已取得初步成效的基础上,从医学、行政学和社会学角度对公共卫生服务中政府责任进行了界定,并参阅当今政治学的理念,提出趋中机制、鼓励社会力量参与及从社会本身的需要出发开展公共卫生服务三个观点。同时,文章也对当前国家基本公共卫生服务开展过程中,出现的一些突出社会问题进行反映,旨在对下一步完善政策措施,并为政策的可持续发展提供有益的参考。",基本公共卫生服务;现状;政府责任;理念;
实现基本医疗服务和基本公共卫生服务均衡发展的社康中心绩效管理模式探索,何能清;黄俊芳;廖小兵;王庆川,中国全科医学(2011年16期),2011/6/5,"目的在政府对社区卫生服务资金投入不足的情况下,探索建立一套能进一步推进基本公共卫生服务和基本医疗服务均衡发展的绩效考核办法,为类似特点的社区卫生服务中心的绩效考核提供借鉴。方法根据国家基本公共卫生服务规范要求,通过查阅文献、专家咨询并结合现场实际情况,按照全面性、重要性、可获得性原则,建立一套新的绩效考核与分配办法,并对实施前后的卫生服务情况进行分析。结果2010年1―10月(实施后),重点人群管理人数同比2009年(实施前)大幅增加;基本公共卫生服务人次同比2009年增长59.21%,基本医疗服务人次同比增长22.51%,卫生总服务人次同比增长31.01%。结论新绩效考核与分配办法的实施有效推动了基本公共卫生服务和基本医疗服务的均衡发展。",社区卫生服务;基本医疗服务;基本公共卫生服务;绩效管理;
基本公共卫生服务筹资均等化政策的实证分析:基于对部分农村地区基本公共卫生经费分配的实地调查,周金玲;孟庆跃;苗壮,中国卫生经济(2011年06期),2011/6/5,"为了解目前基本公共卫生服务的筹资政策能否保证基本公共卫生服务的有效与均等化的供给,通过对部分不发达地区农村基本公共卫生服务的实地考察,对这一政策进行实证分析。调查中发现:财政在基本公共卫生经费分配时没有考虑流动人口的因素,使得部分拨款错位;基本公共卫生经费的使用缺乏成本效益分析,成本不清晰;基本公共卫生经费在基层卫生机构(乡镇卫生院)财务管理中没有与医疗经费独立核算。在此基础上提出了政策建议。",基本公共卫生筹资;流动人口;基本公共卫生服务成本;财务管理;
社区卫生服务机构促进基本公共卫生服务均等化调查分析,李永斌;卢祖洵;王芳;王斌;刘利群;秦怀金;秦耕,中国卫生事业管理(2011年05期),2011/5/15,"目的:了解我国社区卫生服务机构促进基本公共卫生服务均等化实施进展。方法:在20072009年由卫生部组织开展连续性监测,采用统一的调查表对全国36个城市（区）所有社区卫生服务机构进行普查。结果:三年来各项基本公共卫生服务量增长迅速,2009年中心和站的服务人口建档率已达68.00%和59.70%;中心和站平均开展孕产妇保健1180.5人次和127.2人次、儿童保健2061.7人次和198.9人次、计划生育服务1334.3人次和272.2人次;中心和站慢性病有效控制率:高血压72.22%和71.15%、糖尿病70.95%和68.36%。结论:社区公共卫生服务体系已基本建立,但在体系支撑、经费投入和人员配置上仍需加强,应建立社区长效发展机制,从制度建设、内涵建设和绩效考核等方面着力提升均等化服务的质量和水平。",社区卫生;公共卫生服务;均等化;公平性;
卫生部副部长陈啸宏在京调研基本公共卫生服务和医改重大专项实施情况,,中国药房(2011年15期),2011/4/20,"<正>本刊讯2011年3月11日,卫生部副部长陈啸宏率专题调研组赴北京市海淀区调研基本公共卫生服务和""医改""重大专项实施情况。调研组听取了北京市卫生局、海淀区卫生局实施基本公共卫生服务均等化、落实""医改""重大专项以及卫生基础设施建设有关情况的汇报,实地考察了海淀区疾病预",
广西基层医疗卫生机构财政补助政策研究,范世祥;梁宝敏;龙莉莉;刘国艳,经济研究参考(2011年17期),2011/3/21,"<正>基层医疗卫生服务机构包括农村地区的乡村二级卫生服务机构(即乡镇卫生院和村卫生室)和城市地区的社区卫生服务机构。基层卫生机构是我国医疗卫生服务体系的网底,承担着基本医疗和基本公共卫生服务的职责,对改善城乡居民的健康状况和降低群众医药费用起着重要的作用。从机构性质上,政府举办的基层医疗卫生机构是公益性的事业单位",
推进基本公共卫生服务均等化与全民健康――基于公共价值分析的视角,张力文;高博;李宁秀,理论与改革(2011年02期),2011/3/15,"公共卫生服务均等化是每个国家追求的一个重要目标。促进基本公共卫生服务逐步均等化是我国深化医药卫生体制改革五项重大改革之一,本文从公共价值分析的视角,探讨我国基本公共服务卫生均等化的现实需要、实现路径和实现意义,提出公共价值观对我国基本公共卫生服务均等化的启示。",公共价值;公共卫生;均等化;
城乡基本公共卫生服务均等化的成本测算探讨,张媚;肖蕾;张正,中国卫生经济(2011年03期),2011/3/5,"<正>1公共卫生服务成本研究评述20世纪90年代以来,我国公共卫生服务领域的成本核算问题逐渐受到关注,但目前还处于理论和方法学的引入应用阶段,没有一套比较成熟的、广受认可的并且能够全面推广的成本测算方法。1997年卫生部卫生经济研究所成本测算中心和复旦大学共同开发研制了医疗服务项目",基本公共卫生服务;城乡均等化;成本测算;
城市社区实现基本公共卫生服务均等化的对策建议,刘梅,中国卫生事业管理(2010年S1期),2010/12/15,"<正>公共卫生服务均等化是公平理念在卫生服务领域的重要体现,对缩小区域发展差距、促进社会公平公正、维护社会和谐安定、确保人民群众共享改革成果具有重大的政治、经济和社会意义。社区卫生服务是公共卫生服务的网底,承担着为居民提供基本公共卫生服务的重任,研究实现社区公共卫生服务均等化对于实现医改目标具有重要战略意义。本文立足于城市社区,提出实现基本公共卫生服务均等化的建议。",
基本公共卫生服务均等化研究综述,赵红;王小合;高建民;李瑞,中国卫生事业管理(2010年11期),2010/11/20,"随着医改的深入开展,基本公共卫生服务均等化正由理论到实践,由局部向整体全面推进。文章试图从基本公共卫生服务及均等化的内涵、发展逻辑、测量评价、财政转移支付、市场化供给、主要问题等方面研究梳理及述评,提出推进基本公共卫生服务均等法制化建设,探索卫生资源公平分配与有效利用的新路径,构建基本公共卫生服务均等化评价指标体系以及加快城乡卫生综合配套改革衔接的思考建议。",基本公共卫生服务;均等化;综述;
我国流动人口基本公共卫生服务研究进展,黎慕;徐缓,现代预防医学(2010年19期),2010/10/10,"我国将促进公共卫生服务均等化作为医改工作的重点之一,在逐步加强城乡人口享有基本公共卫生服务过程中,流动人口的基本公共卫生服务问题日益突显。本文总结了我国流动人口的基本状况、流动人口主要集中的公共卫生问题以及我国公共卫生机构提供的基本公共卫生服务现状,针对研究和实践提出几点建议:1.以医改精神为基础统领研究工作导向。2.研究流动人口流动性的特征。3.研究流动人口基本公共卫生服务投入的规律。4.研究流动人口动态管理的体制机制。5.研究对流动病患者提供救助和关怀的政策。6.研究借鉴国内外的经验与做法。",流动人口;基本公共卫生服务;
政府购买农村基本公共卫生服务绩效支付初探,吴建;张萌;谢双保;赵要军;崔颖,中国卫生经济(2010年09期),2010/9/5,"本文介绍了公共卫生服务按绩效支付方式的定义、特点和应用情况,并以河南省武陟县购买高血压健康管理服务绩效支付方案为例,结合绩效支付特点和合同管理有关要求,分析了支付方案中存在的主要问题,并就加强公共卫生服务按绩效支付管理提出了操作建议。",农村;公共卫生服务;绩效支付;
推进重庆基本公共卫生服务均等化的策略,张燕;幸奠国;王星月;马海东;王润华,现代预防医学(2010年16期),2010/8/25,"[目的]通过分析重庆在推进基本公共卫生服务均等化中存在的问题和难点,有针对性地提出政策建议。[方法]查阅并分析重庆市卫生统计年鉴(2003～2007年)、第3次全国卫生服务调查重庆市数据资料。[结果]推进重庆基本公共卫生服务均等化,还面临着政府对公共卫生服务重视不够、公共卫生服务体系不健全以及城乡服务能力和获得服务的机会不均等、投入还存在明显差距等问题。[结论]推进基本公共卫生服务均等化,要从落实政府在基本公共卫生服务上的主导责任、完善基本公共卫生服务体系、建立持续稳定的财政投入机制、基层医疗卫生服务机构的人才引进和激励机制、运行机制、绩效考核评价机制等方面着手。",基本公共卫生服务;均等化;策略;
我国高校医疗机构参与社区卫生服务工作现状,朱梅;唐少秋;李英奇;张芯,中国学校卫生(2010年06期),2010/6/25,,卫生系统机构;组织和管理;社区卫生服务;
基本公共卫生服务均等化的内涵与实施策略,王伟;任苒,医学与哲学(人文社会医学版)(2010年06期),2010/6/8,"基本公共卫生服务均等化是改善人群健康而必不可少的一系列活动,对于实现人人享有基本卫生服务的改革目标具有十分重要的意义。对均等化的内涵与目标、意义与作用及均等化与可及性的关联等进行了阐述;借鉴国际经验,提出了分阶段推进、提高财政支付能力和人员能力建设等促进我国基本公共卫生服务均等化的策略与建议。",基本公共卫生服务;均等化;可及性;策略;
