题目,作者,期刊,发表时间,摘要,关键词
国家基本公共卫生服务老年人健康体检的异常检出率分析,李梦宇;连隽;廖子锐;昝子晴;刘璐;尤莉莉;刘远立,中国全科医学(2023年22期),2023/5/18,"背景基本公共卫生服务项目中的老年健康体检服务对老年健康异常状况检出的贡献及老年人对体检结果的获悉情况相关研究报道较少。目的了解≥65岁老年人健康体检中发现的血压异常、血糖异常、超重肥胖、贫血、脂肪肝、胆结石或胆囊炎几种常见病的异常检出情况。方法2019年11―12月，采用多阶段分层抽样法从我国东、中、西部的3省5市20所基层医疗卫生机构选择前来就诊的≥65岁老年人作为调查对象（排除本年度体检结果不详者），根据基本公共卫生服务对象人群划分标准，将研究对象分为一般老年人（不患有高血压或糖尿病）、高血压老年人、糖尿病老年人3类，对所有调查对象进行“一对一”问卷调查（问卷内容包括被调查者一般人口学特征、老年人健康体检异常检出情况）。结果3018例老年人中，2033例（67.36%）自报健康体检异常。不同居住地类型、人群类型、所在地区、户口类型老年人自报健康体检异常率比较，差异有统计学意义（P<0.05）。3018例老年人中，1174例（38.90%）自报检出血压异常，747例（24.75%）自报检出血糖异常，719例（23.82%）自报检出血脂异常，445例（14.74%）自报检出脂肪肝，393例（13.02%）自报检出超重肥胖，238例（7.89%）自报检出胆结石或胆囊炎，60例（1.99%）自报检出贫血。49.13%的已被诊断为高血压的老年人在年度体检中的血压值异常，高血压老年人的血压控制率为50.87%；糖尿病老年人在体检中血糖异常率为60.48%，糖尿病老年人的血糖控制率为39.52%。多因素Logistic回归分析结果显示，糖尿病老年人血压异常检出率是一般老年人的2.57倍[95%CI(2.01,3.29)]，高血压、糖尿病老年人血脂异常检出率分别是一般老年人的1.64倍[95%CI(1.29,2.08)]、1.42倍[95%CI(1.10,1.84)]，高血压、糖尿病老年人超重肥胖检出率分别是一般老年人的2.79倍[95%CI(1.94,4.00)]、2.64倍[95%CI(1.80,3.87)]，高血压老年人脂肪肝检出率分别是一般老年人的2.10倍[95%CI(1.55,2.85)]，而高血压、糖尿病老年人贫血检出率则是一般老年人的0.25倍[95%CI(0.13,0.47)]、0.47倍[95%CI(0.25,0.86)]；农村老年人的血脂异常、胆结石或胆囊炎检出率分别是城市老年人的0.76倍[95%CI(0.64,0.90)]、1.32倍[95%CI(1.01,1.73)](P<0.05。结论基本公共卫生服务的老年人体检项目对老年人早发现、早知晓健康问题具有重要的作用。",老年人;老年人身心健康评价;体格检查;国家基本公共卫生服务;健康促进;
数字技术赋能农村基本公共卫生服务高质量供给研究,江维国;唐书娣,世界农业(2023年05期),2023/5/10,蓬勃发展和广泛应用的数字技术，正成为农村基本公共卫生服务事业高质量发展的重要推动力量。数字技术对农村基本公共卫生服务高质量供给的赋能主要体现在：促进供给主体协同化、供给内容多样化、供给决策智慧化以及供给方式规范化，但数据异质性、数据孤岛、技术过度依赖和数字鸿沟等因素制约了数字技术的赋能效应。因此，要构建标准化数据体系、优化数据共享流程、完善数字决策规则并提高村民数字素养，以充分释放数字技术赋能效应，促进农村基本公共卫生服务高质量供给。,数字技术;农村;基本公共卫生服务;高质量供给;技术赋能;
我国村医公共卫生服务能力现状与提升策略研究,李思清;王萱萱;曹冬丽;陈家应;张朝阳,南京医科大学学报(社会科学版)(2023年02期),2023/4/30,为了解我国村医基本公共卫生服务能力现状，通过调查我国东、中、西部村医公共卫生服务掌握情况，发现纳入分析的3916名村医中，3056人（78.0%）自报具备健康促进能力，2905人（74.2%）自报具备健康管理能力，3471人（88.6%）自报具备预防接种能力，3453人（88.2%）自报具备传染病及突发公共卫生事件报告处置能力。根据不同人群特征进一步分析，发现村医队伍存在结构不合理，公共卫生服务能力不均衡，不同地区村医服务能力差异较大等问题。需要加强高素质青年人才的补充，针对能力薄弱之处重点培训，对偏远地区实施政策优惠，保证村医招的进、留得住，推动队伍的可持续发展。,村医;基本公共卫生服务;服务能力;
制度逻辑与组织策略：对农村地区基本公共卫生服务制度执行偏差的一种新解释,高端阳;李睿;王道勇,中国农村观察(2023年02期),2023/3/28 16:35,基本公共卫生服务制度是一项保障全体人民健康、实现健康公平的重要制度安排，但该项制度在农村地区的执行成效与制度期待具有较大张力，存在制度执行偏差。本文搭建了“制度逻辑-组织策略”的研究框架，力图为该问题提供一种新的解释。本文发现：基本公共卫生服务制度具有多重逻辑，当该项制度嵌入基层医疗组织形成的组织场域时，制度的多重逻辑与基层医疗组织的实践逻辑产生了冲突，给基层医疗组织带来较大制度压力。为缓解制度压力，基层医疗组织采用“拼凑应对”的组织策略实现与基本公共卫生服务制度的适度脱耦，并在这一过程中通过关系动员的方式完成了合法性重建。这一系列的策略行动导致了制度执行偏差。因此，应以价值路径的重塑探寻矫正基本公共卫生服务制度执行偏差的可能方向，缓释制度工具逻辑与价值逻辑之间的张力，实现国家、社区与农村居民的健康共治，以回应制度的内在价值诉求。,基本公共卫生服务制度;基层医疗组织;执行偏差;制度逻辑;组织策略;
边境牧区基本公共卫生服务均等化的重大意义、现实困境与实现策略――基于新巴尔虎右旗的考察,阿梨玛;包银峰,内蒙古农业大学学报(社会科学版)(2023年01期),2023/3/16 9:54,基本公共卫生服务均等化对强化牧区群众国家认同、健康公平和实现牧区共同富裕有重大现实意义。目前，边境牧区虽在基本公共卫生服务均等化建设方面成效显著，但由于医疗卫生基础设施建设基础差、底子薄，仍面临着财政投入可持续性欠佳，医疗卫生服务可及性较差，基层卫生机构专业人才结构性失衡等问题。因此，推动基本公共卫生服务均等化应该增加投入、吸引人才、重视规划，纾解基层医疗卫生机构财政负担，鼓励专业医学人才到边境牧区就业，坚持公共卫生防治工作重心下沉。,边境牧区;基本公共卫生服务;均等化;
我国老年流动人口基本公共卫生服务利用状况及其影响因素,吴迪;王友华;葛选;饶韬;高玉晓;李h,医学与社会(2023年03期),2023/3/10,"目的:了解目前老年流动群体公共卫生服务利用状况及其影响因素，为提高流动老人基本公共卫生服务利用率提供参考。方法:基于2017年全国流动人口动态监测调查数据，以6187名60岁及以上流动老年人口为研究对象，采用二分类logistic回归模型分析老年流动人口基本公共卫生服务利用状况及其影响因素。结果:在6187名研究对象中，知晓国家基本公共卫生服务利用项目的仅有2671名(43.17%),2015名(32.57%)流动老人明确建立了健康档案，3714名(60.03%)流动老人接受过慢性病健康防治教育。同时，分析结果显示，婚姻状态、受教育程度、户口、省内流动等因素均显著影响老年人口基本公共卫生服务利用(P<0.05)。结论:老年流动人口基本公共卫生服务利用率较低，需要提升老年人健康意识，促进基本公共服务均等化。",基本公共卫生服务;利用;老年人;流动人口;影响因素;
均等化试点政策对流动人口基本公共卫生服务利用的影响,徐兴美;刘春光;代震;崔丽伟;于贞杰;郑文贵;胡善菊;井淇,卫生经济研究(2023年03期),2023/3/2,目的：在均等化试点政策下，了解流动人口基本公共卫生服务利用情况及影响因素，为政策的深入实施和改进完善提供建议。方法：采用2018年全国流动人口卫生计生动态监测调查数据，运用χ2检验、二元Logistic回归方法检验均等化试点政策对流动人口基本公共卫生服务利用的影响。结果：流动人口建档率为28.3%，性别、收入、受教育程度、婚姻状况、户籍性质、是否参加医疗保险、流动范围、流动时间、流动原因、是否居住在试点城市是影响流动人口建立健康档案的因素。结论：流动人口基本公共卫生服务利用处于较低水平，均等化试点政策效果不明显，应加大宣传力度，优化资源组合方式，加快信息化建设，助力均等化试点政策的落实。,流动人口;基本公共卫生服务;均等化试点政策;
基本公共卫生服务项目绩效评价指标体系优化研究――基于政策绩效视角,陈露;李文思,财政监督(2023年03期),2023/2/1,基本公共卫生服务作为我国一项重要的公共政策，主要通过开展服务项目来实现政策目标。绩效评价对提高基本公共卫生服务质量和效率非常关键，其中绩效评价指标体系的设计是绩效评价工作的核心内容，因此本文将基于政策绩效视角对现有基本公共卫生服务项目绩效评价指标体系进行优化研究，以期建立科学的绩效评价指标体系，积极发挥绩效考核的“指挥棒”作用，指出服务优化的落实方向，保障基本公共卫生服务政策目标的顺利达成。,基本公共卫生服务;政策绩效;绩效评价指标体系;
基本公共卫生服务质控中心绩效评价指标体系构建研究,孙华君;林姗;徐雅萱;张雅欣;汤乃军;李婧;李刚;袁源;杜,中国医疗管理科学(2023年01期),2023/1/15,目的构建基本公共卫生服务质控中心绩效评价指标体系，为评价基本公共卫生服务质控中心绩效情况提供依据。方法通过文献分析法初步拟定评价指标体系框架，选取从事卫生健康行政管理、医疗卫生质量控制、基本公共卫生服务等工作的14位专家，通过德尔菲法对专家进行两轮问卷询问，利用层次分析法计算三级指标所占的权重大小。结果两轮发出问卷全部回收；专家权威系数Cr=0.87，专家具有较高威信；两轮的Kendall'sW由0.237上升为0.357，差异有统计学意义（P<0.001），提示专家所持意见趋于统一；构建了基本公共卫生服务质控中心绩效评价指标体系，包含4个一级指标、7个二级指标和44个三级指标。结论研究构建的基本公共卫生服务质控中心绩效评价指标体系具有可行性，可为评价基本公共卫生服务质控中心工作开展情况提供参考。,基本公共卫生服务;质量控制;绩效评价;指标体系;
居民社会资本对基本公共卫生服务利用的影响研究,詹祥;周颖;许兴龙;李金海;朱铁林,中国卫生事业管理(2023年01期),2023/1/15,目的：了解居民社会资本与其基本公共卫生服务利用的关联，从社会学、管理学交叉视角探求提升基本公共卫生服务利用效率的新路径。方法：以Onyx和Bullen的社会资本量表为基础，于2021年3至6月对南京市某社区居民进行综合问卷调查，使用Mann-WhitneyU、Kruskal-WallisH检验以及logistic回归分析社会资本各维度得分与基本公共卫生服务的二元关联以及社会资本各维度得分对基本公共卫生服务利用的总效应。结果：签约家庭医生、建立健康档案、健康教育、生活方式指导、突发公共卫生事件在社会资本全8个维度差异显著；政府公益热线知晓和利用在6个维度(社区参与、主动性、邻里关系、家人和朋友联系、多样性容忍度及其他)差异显著；接种疫苗在5个维度(社区参与、主动性、邻里关系、家人和朋友联系及其他维度)差异显著。结论：主动性、信任与安全感以及多样性容忍度正向促进家庭医生签约；邻里关系正向促进健康档案建档率和流感疫苗接种率；社区参与正向促进健康教育参与度和突发公共卫生事件接受度；社区参与和主动性正向促进生活方式指导接受频率。,社会资本;基本公共卫生服务;服务利用;影响;
天津市基本公共卫生服务项目预算绩效管理现状、问题及对策,孙华君;胡羽;黄丽雯;马莹;龚佳彤;张雅欣;李婧;杜,卫生经济研究(2023年01期),2023/1/15,"从绩效目标设置、绩效运行监控、绩效评价及绩效管理结果应用等方面,对天津市基本公共卫生服务项目现状进行综合分析,发现存在的问题并分析成因,提出提高基本公共卫生服务项目预算绩效管理水平的建议:建立事前绩效评估机制、合理调整绩效目标、改善绩效运行监控方式、科学开展绩效评价、强化绩效管理结果应用。",基本公共卫生服务;预算绩效管理;绩效目标;绩效评价;
社会歧视对我国流动人口健康状况的影响,张环宇;冯亚杰;刘俊萍;刘智新;邹丹丹;王晨;赵娟;梁立波,医学与社会(2023年01期),2023/1/10,"目的:探讨基本公共卫生服务利用情况在流动人口遭受的社会歧视与其健康状况之间的中介效应，为改善流动人口健康状况提供参考。方法:利用2017年全国流动人口动态监测调查数据，采用logit回归法分析流动人口所受社会歧视、健康状况及基本公共卫生服务利用情况之间的关系，并用KHB效应分解法检验基本公共卫生服务利用情况的中介作用。结果:流动人口所受的社会歧视影响其健康状况，社会歧视对健康状况的直接效应为-0.010,其95%CI为(-0.030,-0.019);基本公共卫生服务利用情况在社会歧视与健康状况之间起中介作用，中介效应占总效应的30.7%。结论:流动人口所受社会歧视能直接影响其健康状况，又可以通过影响基本公共卫生服务利用情况间接影响健康状况。因此应在减少流动人口在流入地受歧视机会的同时，完善基本公共卫生服务利用情况，提高人群健康水平。",基本公共卫生服务;健康状况;社会歧视;流动人口;
社会融合对流动老人基本公共卫生服务利用的影响研究,胡依;闵淑慧;郭芮绮;成晓芬;李贝,现代预防医学(2022年22期),2022/11/25,"目的了解流动老人基本公共卫生服务利用情况，以及社会融合对基本公共卫生服务利用的影响。方法于2021年7―12月，采用方便抽样的方法，抽取广州市、深圳市、江门市452名流动老人进行问卷调查。采用二元logistic回归模型分析流动老人社会融合对建立健康档案、接受健康教育和老年人健康管理之间的影响。结果在452名流动老人中，60.8%建立了居民健康档案，接受过健康教育和老年人健康管理的分别有64.4%和60.0%。Logistic分析结果显示，流动老人的居民健康档案行为受到月消费水平（B=0.368,P<0.05）、社区文体活动参与程度（B=0.362,P<0.01）、居留意愿（B=0.408,P<0.001）、年龄（B=-0.513,P<0.01）、户籍类型（B=0.742,P<0.01）、流动类型（B=-0.539,P<0.05）等变量的影响；健康教育服务利用行为受到社区文体活动参与程度（B=0.354,P<0.01）、年龄（B=-0.411,P<0.05）、户籍类型（B=0.561,P<0.05）的影响；老年人健康管理服务利用行为受到社区文体活动参与程度（B=0.291,P<0.01）、居留意愿（B=0.239,P<0.05）、年龄（B=-0.474,P<0.05）、流动类型（B=-0.471,P<0.05）、流动时间（B=0.225,P<0.05）、流动目的（B=0.328,P<0.01）的影响。结论流动老人基本公共卫生服务利用率较低，社会融合会对流动老人的基本公共卫生服务利用产生积极影响。可以通过提高流动老人获得基本公共卫生服务的能力和社会融合水平来促进流动老人的基本公共卫生服务利用，从而实现基本公共服务均等化。",流动老人;社会融合;基本公共卫生服务利用;
国家基本公共卫生服务项目实施现状及问题分析,程念;宋大平;崔雅茹,中国卫生经济(2022年11期),2022/11/5,"通过对国家基本公共卫生服务项目进行面上调查和典型地区调查发现,国家基本公共卫生服务项目已经建立了完善的组织管理体系、明确的分工协作机制和稳定的筹资增长机制,服务内容不断丰富,服务提供更加精细化,居民获得感得到提升。建议进一步完善相关政策,建立以需求为导向的基本公共卫生服务项目动态调整机制;研究以成本为基础的服务标准测算方法并制定操作手册;提供精细化与个性化服务;加快发挥智慧化手段的助力作用。",国家基本公共卫生服务项目;基层卫生服务;家庭医生签约;
国家基本公共卫生服务及医保支付方式改革在高血压防治中的作用,郭浚文;周佳;郭子宏,中华高血压杂志(2022年10期),2022/10/15,"<正>最新数据显示，我国年龄≥18岁居民血压正常高值检出粗率39.1%,高血压患病粗率27.9%,估计全国高血压患者为2.45亿例[1]。我国高血压的防控形势非常严峻，高血压已成为严重的公共卫生问题。本文从国家政策入手，综合分析国家基本公共卫生服务项目及医保支付方式改革对高血压患者管理、治疗等方面的影响，阐述国家基本公共卫生服务项目及医保支付方式改革在高血压防治中的作用，探讨进一步优化两个体系对高血压防治的支撑作用。",
基本公共卫生服务项目2型糖尿病患者健康管理数据质量评价指标体系构建,秦莉;陈波;马吉祥;徐建伟;李剑虹;王文绢,中国公共卫生(2022年10期),2022/10/15,目的构建基本公共卫生服务项目2型糖尿病患者健康管理数据质量评价指标体系，为促进2型糖尿病患者健康管理服务提供科学适宜工具。方法通过文献回顾国内外电子健康档案的数据质量评价维度及指标，结合2型糖尿病患者健康管理的工作需要和数据特点，构建具有针对性的数据质量评价指标体系；并利用2012年1月―2017年12月湖南湘潭某区和四川成都某区2型糖尿病患者健康管理项目数据对该指标体系进行应用可行性评价。结果构建的基本公共卫生服务项目2型糖尿病患者健康管理数据质量评价指标体系包含数据的合理性、完整性和一致性3个维度共7个指标，通过实际应用发现该指标体系具有良好的应用可行性；2012年1月―2017年12月湖南湘潭某区和四川成都某区的2型糖尿病患者健康管理数据质量总体上较好，且近年来改善明显，但两地区数据仍存在数据格式不一致、重复录入和数据匹配率低等现实问题。结论本研究构建的基本公共卫生服务项目2型糖尿病患者健康管理数据质量评价指标体系在实际应用中具有良好的适宜性和可操作性，建议将数据质量评价纳入常规工作中以发现患者管理过程中存在的问题。,2型糖尿病;健康管理;数据质量;评价指标体系;基本公共卫生服务项目;
政策工具视角下我国省级基本公共卫生服务补助资金管理政策分析,吴腾燕;付亚群;赵婧雨;杨莉,中国卫生经济(2022年10期),2022/10/5,"目的:全面分析我国省级基本公共卫生补助资金管理政策现状,并针对可能存在的问题提出相应的政策建议,以期为优化补助资金管理提供科学参考。方法:采用质性研究的开放式编码方法对我国省级出台的24份基本公共卫生补助资金管理政策进行编码,并基于供给型、需求型和环境型政策工具分析框架进行量化分析。结果:省级基本公共卫生补助资金管理政策在发文时间和地区分布上存在差异,部分省份的政策文本未及时更新,政策工具的运用呈现偏环境型、轻需求型特点。结论:各省份应因地制宜和与时俱进地制定资金管理政策不断优化政策工具的运用比例,积极构建统筹化、精细化和可持续性的资金管理策略。",基本公共卫生服务补助资金;资金管理;政策文本量化分析;
医防融合背景下我国基层医疗卫生机构卫生技术人员现状调查,李丽芬;陈浩;刘毅;王萌康;郑棋;王静雯;张然;郑;郭岩,医学与社会(2022年09期),2022/9/10,"目的:通过对我国基层卫生技术人员进行现状调查，分析现存问题，为推进我国基层医疗卫生医防融合服务提供参考意见。方法:采用多阶段分层随机抽样，对5个省的基层卫生技术人员进行问卷调查。结果:基层卫生技术人员的高学历和高职称比例具有社区卫生服务中心占比大于乡镇卫生院，东部地区大于中西部地区的趋势。获得全科医师资格的临床人员占临床人员总数的46.2%;专业背景为预防医学的公共卫生人员不足20%,取得公共卫生医师执业资格的公共卫生人员不足15%。74.5%的临床人员和30.5%的公共卫生人员同时承担着基本医疗服务和基本公共卫生服务，对慢性病与传染病防控管理及健康教育与促进等专业知识的培训需求均较大。结论:基层卫生技术人员分布差异明显且结构不合理，全科医师和公共卫生人才不足，临床人员缺乏必要的公共卫生类知识。应该加大政策支持力度，通过科室信息整合、绩效考核、职称评聘等方式，加强临床和公共卫生人员团队及专业知识的融合。",医防融合;基层医疗卫生机构;卫生技术人员;
2021―2022年版英国质量与结果框架的设计及其对我国的启示,李雪竹;匡莉;张慧,中国全科医学(2022年28期),2022/8/12 15:46,我国基层医疗卫生机构在承担基本公共卫生服务和基本医疗服务项目方面存在绩效考核体系和支付制度不完善的问题。英国质量与结果框架(QOF)经过多次调整，最新版本更加注重慢性病防控与疾病管理质量。本研究从管理与运作体系、指标体系的演变历程及新版(2021―2022年版)指标构成、计分规则和按绩效付费规则等方面对英国QOF进行介绍，并剖析了英国新版QOF的设计细节和运行情况。本研究发现，英国QOF是一个以结果为导向的质量控制系统和以报酬为导向的激励机制，其以主要慢性病及其危险因素为管理重点，通过设置三级指标体系，并规定指标分值和每分值对应的金额，实现将全科诊所服务质量与其绩效报酬相联系，能够从整体上提高英国卫生系统的效能。借鉴QOF的经验，我国应完善基本公共卫生服务规范与绩效考核指标体系、基层门诊慢性病支付方式，促进基本公共卫生服务资金和基本医疗保险基金的统筹使用。,质量与结果框架;按绩效付费;基本公共卫生服务;基本医疗服务;国家卫生服务;英国;
高血压患者的国家基本公共卫生服务自评受益率与服务满意度调查,杨凌鹤;刘美岑;陈新月;廖子锐;昝子晴;连隽;杨思琪;张思琪;尤莉莉;刘远立,中国全科医学(2022年25期),2022/7/27,背景国家基本公共卫生服务项目自2009年至今已开展13年，是我国迄今为止针对高血压患者开展的最大范围的人群干预实践，了解该人群对干预实践的反馈，对于推动国家基本公共卫生服务的持续发展非常重要。目的探讨高血压患者的国家基本公共卫生服务自评受益率与满意度，为促进国家基本公共卫生服务实现高质量发展提供科学依据。方法采用多阶段分层抽样方式，于2019年11―12月在我国东、中、西部地区5市10区(县)20个社区卫生服务中心或乡镇卫生院抽取2419例≥35岁的高血压患者进行问卷调查。问卷由两部分组成：一般人口学信息和高血压患者健康管理情况。结果86.26%(2072/2402)的调查对象认为其所接受的基本公共卫生服务对其健康改善具有帮助。分别有97.15%(2349/2418)、94.09%(2275/2418)、88.16%(2129/2415)、87.81%(2118/2412)、61.36%(1469/2394)、95.04%(2297/2417)、83.67%(2013/2406)、82.34%(1981/2406)、95.53%(2310/2418)的高血压患者对医护人员服务态度、医护人员服务水平、体格检查、健康教育、中医药治疗、随访服务、高血压并发症筛查、血压控制效果及总体服务表示满意。不同文化程度、不同自评健康状况、是否在基层首次发现血压异常、过去1年内接受不同随访服务次数的高血压患者的自评获益率比较，差异有统计学意义(P<0.05)；不同文化程度、是否在基层首次发现血压异常、过去1年内接受不同随访服务次数的高血压患者总体服务满意度比较，差异有统计学意义(P<0.05)。结论高血压患者的国家基本公共卫生服务自评受益率及满意度较高，应注重国家基本公共卫生服务的规范提供及城乡同质化，以促进国家基本公共卫生服务实现高质量、可持续的发展。,国家基本公共卫生服务;高血压;健康管理;健康促进;自评受益率;服务满意度;
