题目,作者,期刊,发表时间,摘要,关键词
基于数据包络分析的深圳市社区基本公共卫生服务效率评价,林德南;梁亮;梁实;陈研;宗文萍;廖剑锋;王心旺,中国卫生统计(2017年02期),2017/4/25,"目的利用DEA评价2009-2013五年间各区样本社康中心基本公共卫生服务的效率,寻求有效的资源配置措施和方法,对进一步提高政府卫生支出效益进行探讨并提出可行的政策建议。方法随机抽取深圳市各区67家社康中心,利用数据包络分析,对基本公共卫生服务项目进行效率评价。结果(1)深圳市社区基本公共卫生服务的综合效率、纯技术效率、规模效率总体较高,但仍有部分地区在不同年度间存在投入冗余与产出不足情况;(2)规模效率少于1的地区除了2009年的宝安区、龙华新区和大鹏新区是规模递增,大部分地区处于规模报酬递减阶段。结论为了达到最优配置的基本公共卫生服务项目投入与产出,政府及各级公共卫生服务机构必须形成有效落实的政策法规,优化资源投入,合理的管理架构,高效的服务质量,健全的绩效考核体系,从而推动项目的有效开展,提高资源利用率。",社康中心;基本公共卫生服务项目;数据包络分析;效率评价;
深圳市基本公共卫生服务项目成本测算研究,林德南;梁亮;梁实;陈研;宗文萍;廖剑锋;王心旺,中国卫生统计(2017年02期),2017/4/25,"目的分析深圳市公共卫生服务成本及其构成情况,为社区公共卫生服务项目补偿制度提供科学的依据。方法随机抽取深圳市67家社区健康服务中心进行公共卫生服务成本测算和调查。结果深圳市2013年基本公共卫生服务项目的实际项目总成本为21766.41万元,标化后的项目成本为23032.16万元,标化后的项目总成本高于实际项目总成本,人均成本为68.47。结论深圳市人均基本卫生服务成本与实际需求相比较低,公共卫生服务投入有待进一步提高,政府应根据公共卫生服务项目内涵的变化,结合深圳市人口结构、经济发展状况,提高基本公共卫生服务项目的经费补助以及进行资源的合理配置。",基本公共卫生服务;社区公共卫生服务;成本测算;
河南省结核病基本公共卫生服务项目基线调查,张艳秋;何景阳;蒋建国;甄新安;徐吉英;邢进;郭大城,现代预防医学(2017年06期),2017/3/25,"目的掌握河南省基层医疗卫生机构结核病防治工作开展情况,作为结核病基本公共卫生服务项目的基线数据,为今后评价结核病基本公共卫生服务项目提供依据。方法采用回顾性研究方法,全省17个省辖市随机各抽取1县1区,每个县区、济源市和10个直管县随机各抽取2个乡镇(办事处)2个村(居委会)的基层医疗卫生机构。现场填写调查表并核对原始材料,使用Excel/SPSS15.0软件进行分析。结果截至2015年底,本次抽样到的县区,综合评分均值为71.95分,省辖市和直管县之间差异无统计学意义。报告的结核病患者(包括耐多药患者)管理得分率为83.32%,肺结核可疑症状者发现得分率为57.57%,服药规范得分率为79.38%,其中乡镇肺结核可疑症状者筛查达标率为26.67%。基本公共卫生服务实施过程中面临弥补经费缺口及人力资源建设的挑战。结论截至2015年底,河南省结核病基本公共卫生服务项目各项工作处于起步阶段,部分三级指标已经实现。需继续开展培训,加强基层建设,探索保障措施。",结核病;基本公共卫生;基线调查;
福建新疆农村基本公共卫生服务利用现况调查,唐彩云;王晓霞;张艺馨;张万起,中国卫生事业管理(2017年03期),2017/3/15,"目的:了解并比较福建新疆两地农村居民对国家基本公共卫生服务的利用现况,为进一步合理地推进全国农村基本公共卫生服务的实施提供参考和借鉴。方法:以新疆和福建两地农业县的农村常住居民为研究对象,由经过统一培训的调查员进行入户问卷调查。结果:农村基本公共卫生服务各个项目间的接受率有差异,其中儿童免疫、孕产妇建立手册和体检等传统项目的利用率高,分别达96.9%,96.6%,而健康随访、中医药调养、健康评估等服务的利用率低;福建和新疆两地农村基本公共卫生服务项目接受率存在差异,总体上福建农村居民的基本公共卫生服务利用度高于新疆,而在中医方面新疆的实施情况比福建好。结论:农村地区不同基本公共卫生服务项目的接受率存在明显差异,福建新疆两地农村基本公共卫生服务项目发展不均衡。",基本公共卫生服务;农村;政策建议;
抚顺市和营口市407例居民基本公共卫生健康教育服务知晓情况调查,孙延波;李慧;沈世闯,中国健康教育(2017年01期),2017/2/28 14:18,"目的了解城乡居民基本公共卫生健康教育服务知晓情况。方法对抚顺市和营口市部分城乡居民进行抽样调查。采用SPSS17.0统计软件进行均数和率的分析。结果共调查407人,平均年龄(41.07±11.65)岁,文化程度以初中(45.7%)和大专及以上(30.7%)为主。城乡居民国家基本公共卫生服务知晓情况约为49.0%,城市居民约为40.2%,农村居民约为57.9%,农村高于城市,差异具有统计学意义(P<0.05);健康教育5项服务内容中,个体化健康教育指导的开展率较低,城市、农村都低于50%;健康教育宣传栏、健康教育资料知晓率较高,城市、农村都高于70%;健康教育讲座和健康教育咨询活动利用率较高,城市、农村都高于65%。结论调查地区农村居民基本公共卫生健康教育服务知晓率明显高于城市居民,但整体水平有待于提高。",基本公共卫生服务;健康教育;现状调查;
山东省基本公共卫生服务资源配置评价,张慧;于贞杰,中国卫生统计(2017年01期),2017/2/25,"目的分析山东省基本公共卫生服务资源配置状况。方法采用熵权法、TOPSIS法和系统聚类法对山东省17个地级市的基本公共卫生服务资源配置进行综合评价。结果熵权法计算的6项指标的权重分别为0.2526、0.0745、0.0776、0.4764、0.0421、0.0767;TOPSIS综合排序排名前三的依次为潍坊、济南、青岛;系统聚类将17个地级市分为四类:优秀(潍坊),良好(济南、青岛、烟台、威海),中等(淄博、枣庄、东营、济宁、泰安、滨州、莱芜、临沂),较差(日照、德州、聊城、菏泽)。结论山东省基本公共卫生服务资源配置存在区域差异,基层卫生人员及床位配置不足;应改善区域基本公共卫生服务资源配置差异;构建基本公共卫生服务资源多元供给机制;建立基本公共卫生服务资源均等化绩效考评机制。",基本公共卫生服务资源;综合评价;熵权法;TOPSIS法;系统聚类;
中医药健康管理在乡村基本公共卫生服务中的应用,王晓霞;唐彩云;张艺馨;张万起,现代预防医学(2017年03期),2017/2/10,"目的了解并比较全国多个省市乡村基本公共卫生中医药健康管理服务开展情况,为项目实施提供参考。方法通过多阶段随机抽样,对11个省市的乡村居民进行基本公共卫生服务利用的问卷调查。结果各省市乡村儿童中医调养服务接受率范围在0.0%85.6%,老年人中医体质辨识服务接受率在3.9%92.8%之间,各省市间乡村居民中医药健康服务接受率存在统计学差异（P<0.001）;儿童和老年人其他基本公共卫生服务项目的接受率在24.5%89.5%,中医药服务与之相比明显偏低。结论乡村居民不同程度接受过基本公共卫生中医药健康管理服务,但不同地区间中医药服务接受率参差不齐;与其他基本公共卫生服务比较,中医药服务实施情况较差,项目实施有待进一步督促和完善。",中医药;健康管理;基本公共卫生服务;乡村;
流动特征对流动人口孕产妇基本公共卫生服务利用的影响探讨,韩思琪;陈雯;凌莉,现代预防医学(2017年01期),2017/1/10,"目的了解流动人口孕产妇基本公共卫生服务的利用现状,探索不同流动特征对孕产妇基本公共卫生服务利用的影响。方法利用2014年全国流动人口卫生计生动态监测数据,选取北京市朝阳区、青岛、厦门、嘉兴、深圳、中山6座城市(区)的1477名流动孕产妇作为研究对象。采用多水平logistic回归模型,分析流动特征对流动孕产妇基本公共卫生服务利用的影响。结果流动孕产妇孕12周内建册和孕期接受5次及以上产前检查的比例分别为89.00%和78.68%,产后访视的接受率为62.38%。其中产前基本公共卫生服务利用在城市水平间存在组内聚集性(ICC=0.14,P<0.01;ICC=0.40,P<0.01)。两水平logistic回归分析显示流动范围、流动时间和流入地流动人口的比例对孕早期建册和产前检查服务的利用均存在影响;流动原因主要影响产前检查服务的利用。单水平logistic回归分析发现流动范围影响孕产妇产后访视服务的利用。结论流动特征不同的流动孕产妇基本公共卫生服务利用水平存在差异。应根据孕产妇的不同流动特征提供针对性、可及性的服务措施。",流动人口;孕产妇基本公共卫生服务;多水平logistic回归;
乡村医生在国家基本公共卫生服务项目中的任务量测算,辛倩倩;尹德卢;殷涛;政晓果;王利红;陈博文,中国卫生经济(2017年01期),2017/1/5,"目的:理清乡村医生在国家基本公共卫生服务项目中承担的主要任务量与分配经费。方法:通过问卷调查,收集6省300家乡镇卫生院国家基本公共卫生服务项目承担任务量以及资金分配情况等,采用当量法测算乡村医生承担任务量和资金分配比例。结果:乡村医生所承担的总任务量占乡镇卫生院任务量的47.04%,而拨付乡村医生的经费比例为35.83%。不同省份间,乡村医生任务量和经费比例差异较大,仅有一个省份经费比例高于乡村医生工作量比例。结论:乡村医生承担的项目任务量和经费比例不协调,应提高其经费拨付比例,切实保障乡村医生的利益和积极性。",乡村医生;国家基本公共卫生服务;任务量;当量法;
国家基本公共卫生服务项目资金绩效审计探析,胡明晖,中国卫生经济(2017年01期),2017/1/5,"目的:探索国家基本公共卫生服务项目资金绩效审计方法。方法:根据当前国家基本公共卫生服务项目资金在管理和使用中存在的问题并结合审计经验,分析并提出相应的对策和审计方法。结果:采取逻辑分析法和财务反推法,加强对事前、事中审计能够提高审计质量,规范国家基本公共卫生服务项目资金的管理和使用。结论:鼓励有条件的地区,逐步对国家基本公共卫生项目采取资金绩效审计,以提高项目资金的使用效益,让百姓获得更大的实惠。",基本公共卫生服务项目;项目资金;绩效审计;
基于RBRVS模型测量国家基本公共卫生服务项目工作量,明慧;刘畅;付谦;邵天;付航;唐尚锋;贺知菲;咸越;邵飘飘;刘春燕;冯占春,中国卫生经济(2017年01期),2017/1/5,"基本公共卫生经费是政府为购买基本公共卫生服务而筹集的专项补助经费,但目前经费管理存在诸多问题,经费使用效率不高。为提高基本公共卫生经费使用效率,改善基本公共卫生服务系统绩效,充分发挥基本公共卫生资金的民生效益,课题组尝试借鉴RBRVS模型测量基本公共卫生服务项目工作量,用来指导基本公共卫生服务项目资金的使用和分配。",RBRVS模型;基本公共卫生服务项目;工作量测量;
社区基本公共卫生服务医务人员工作满意度调查,温鑫;郗瑞;余琦娴;曹冀;刘鸿娟;王媛;芦文丽,中国卫生事业管理(2016年12期),2016/12/15,"目的:了解社区卫生服务中心从事基本公共卫生服务医务人员的工作满意度现状及相关因素。方法:在单因素分析的基础上,进行逐步回归分析工作满意度得分相关因素。结果:从事基本公共卫生服务的医务人员工作满意度低于不从事基本公共卫生服务的医务人员(t=3.819,P<0.05),工作单元中主要从事基本公共卫生服务或基本医疗服务的人员比两项服务都从事的医务人员工作满意度高(F=6.25,P<0.05)。从事基本公共卫生服务与否、收入和工龄是与社区医务人员工作总体满意度独立相关因素。结论:探索社区卫生服务中基本医疗与基本公共卫生服务的协调机制,对于改善工作满意度,提高社区卫生服务质量具有现实意义。",工作满意度;医务人员;社区卫生服务;基本公共卫生服务;
多元主体供给下基本公共卫生服务补偿机制研究――以乌鲁木齐市为例,葛文峰;张晔,卫生经济研究(2016年11期),2016/11/3 15:58,"选择乌鲁木齐市的基层医疗卫生机构作为调查对象,通过问卷调查和实地访谈,掌握多元供给主体下基本公共卫生服务项目补偿现状,探究存在的主要问题和原因,结合访谈资料,利用扎根理论对其进行分析、构建理论模型,最终给出政策建议。",基本公共卫生服务;补偿机制;扎根理论;
国家卫生和计划生育委员会基层卫生司督导西藏自治区开展国家基本公共卫生服务项目,,中国药房(2016年30期),2016/10/30,"<正>本刊讯为配合2015年度国家基本公共卫生服务项目绩效考核工作,2016年7月26-29日,国家卫生和计划生育委员会基层卫生司会同财政部社保司对西藏自治区实施国家基本公共卫生服务项目情况进行了督导。2009年以来,西藏自治区按照国家统一部署,实施了国家基本公共卫生服务项目,2016年人均基本公共卫生服务补助",
贵州省遵义市基层医疗机构慢性病管理的基本公共卫生服务需求评估,刘诗莉;李莉;杨海琴;汪梅;刘颖;杨映萍;李颖,第三军医大学学报(2016年23期),2016/10/21 17:00,"目的了解贵州省遵义市基层医疗机构基本公共卫生服务中慢性非传染性疾病(noncommunicablechronicdisease,NCDs)管理的需求(NCDs患病现状、NCDs相关行为生活方式因素管理现状及存在的问题),对该地区慢性病管理提出建议。方法通过分层随机抽样抽取了红花岗区的8个基层医疗机构为研究地点,采用问卷调查和个人深入访谈收集资料。结果问卷调查了316人,该人群患有10种NCDs,其中57.6%的被调查者患有两种以上的NCDs。患病率较高的五种NCDs依次为高血压(54.6%),糖尿病(20.1%),血脂异常(13.4%),冠心病(11.7%),慢性支气管炎(8.4%)。被调查者中,36.1%的人缺乏运动,吸烟率为16.1%,饮酒率为7.9%,18.1%的人睡眠时间少于5h,40.5%的人食用蔬菜不足300g,12%的人经常食用甜食,16.1%的人口味偏咸。来自8个社区的8名NCDs管理医务人员参加了个人深入访谈,结果也表明该地区常见的NCDs除了高血压和糖尿病外,冠心病、脑梗塞、心肌梗塞、高血脂也比较常见,NCDs患者的不良生活方式和饮食习惯的干预效果不够理想。结论被调查地区居民的NCDs负担较重,随着社会经济发展,该地区基本公共卫生项目中NCDs管理的疾病应该从当前的糖尿病和高血压逐渐扩充,纳入血脂异常、冠心病等常见NCDs;应加强对该地区人群运动、睡眠、吸烟饮酒及饮食习惯(蔬菜、盐和糖的摄入)的干预和指导。",社区;基本公共卫生服务;慢性病;生活行为方式;
全科医生小词典――基本公共卫生服务均等化,,中国全科医学(2016年29期),2016/10/15,"<正>基本公共卫生服务均等化是指,每个公民都能平等地获得基本公共卫生服务。基本公共卫生服务范围包括:计划免疫、妇幼保健、院前急救、采供血以及传染病、慢性病、地方病的预防控制。我国现阶段的基本公共卫生服务均等化主要由国家确定若干服务项目,免费向城乡居民提供。基本公共卫生服务的内容是根据居民的健康需要和政府的财政承受能力确定的。在保障国家确定的基本公共卫生服务均等化的基础上,鼓励",
基层艾滋病防治工作常态化思考,吴泥亚;陈任;秦侠;马颖;方桂霞;胡志,中国艾滋病性病(2016年09期),2016/9/26,"随着中国经济文化的发展,人口流动速度加快,农村地区逐渐成为艾滋病防治工作的重点。通过文献阅读发现,""特殊化""是中国基层艾滋病防治工作持续发展的短板,""常态化""是保障基层艾滋病防治工作可持续发展的关键。该文总结阐述了基层艾滋病防治工作""常态化""的概念和内涵,根据基层艾滋病流行现况和趋势,按照""常态化""打破特殊,实现常态和维持常态的三层含义,结合当前的基本公共卫生服务体系,从政策支持、人才建设、财力保障和考核创新4个方面,探索实现基层艾滋病防治工作常态化的可持续性。",基层艾滋病防治工作;艾滋病;常态化;
河南省农村卫生室开展基本公共卫生服务的现状与困境破解――基于216个村卫生室的实证研究,袁秀伟,中国卫生事业管理(2016年09期),2016/9/15,"目的:对河南省农村卫生室开展基本公共卫生服务项目的状况及影响因素进行分析。方法:采用问卷调查的方法,选取河南省216个村卫生室为研究对象,从卫生室人员规模、服务人口及诊疗量、设备情况、基本公共卫生服务项目实施效果评价及影响因素等方面进行统计描述和分析。结果:目前河南省村卫生室开展基本公共卫生服务能力不足,项目开展不均衡,项目的开展受到多方面因素的制约。建议:完善基本公共卫生服务政策体系,保证政策完整性和连续性;加强资源配置力度,提升卫生室公共卫生服务能力。",农村卫生室;基本公共卫生服务;调查分析;
流动人口基本公共卫生服务可及性及影响因素分析,郭静;邵飞;范慧;薛丽萍;吴亚琴,中国卫生政策研究(2016年08期),2016/8/25,"目的:了解流动人口基本公共卫生服务可及性及其影响因素。方法:以安德森卫生服务利用模型为理论基础,使用""流动人口卫生计生服务流出地监测调查(2014)""数据,采用多水平Logistic回归模型从宏观和微观两个层面,对流动人口基本公共卫生服务可及性及影响因素进行分析。结果:流动人口基本公共卫生服务利用率偏低,其在流出地和流入地均有卫生服务需求;对于全人群适用的健康档案、健康教育和健康体检服务项目的利用,流动人口群体内部存在差异;在同一调查点,流动人口卫生服务利用存在组内聚集性,多水平logistic回归分析发现经济社会发展水平、流出地卫生资源配置水平这两个宏观因素和流动人口的性别、年龄、受教育程度、医疗保险参保情况、流动范围及就业单位性质等个体微观因素,是影响流动人口基本公共卫生服务可及性的主要因素;不同服务项目的影响因素既有共性又有差异。结论:流动人口基本公共卫生服务可及性较差,应强化健康教育和引导干预;不同服务项目利用水平存在差异,应重点关注全人群适用项目和慢性非传染病管理;宏观环境因素和微观个体因素对服务可及性均存在影响,因此在增加服务供给的同时还应从流动人口特征着手,提高其主动性和参与意愿;不同性质就业单位中的流动人口卫生服务利用情况不同,应考虑单位及职业特征对服务利用的影响。",流动人口;基本公共卫生服务;可及性;影响因素;
中部经济欠发达地区农村基本公共卫生服务利用情况调查,李翔;王晓霞;陈雯;吴亚兰;孙宇;王伟;张艺馨;张万起,中国卫生事业管理(2016年08期),2016/8/15,"目的:了解中部经济欠发达地区农村基本公共卫生服务的利用情况,为提高农村地区基本公共卫生服务能力和实现国家基本公共卫生服务均等化提供科学依据。方法:采用多阶段随机抽样方法抽取了安徽和江西两地经济发展欠发达地区农村常住居民和医务人员进行问卷调查,均进行国家基本公共卫生服务的知晓情况和满意情况问卷调查;农村居民还需采用统一设计的问卷调查基本公共卫生服务项目的利用情况,问卷涉及7类32项服务项目。结果:本次共调查农村居民624人,医务人员38人。农村居民对国家基本公共卫生服务的知晓率和满意率均在70%以上,与医务人员相比较低,且表示非常了解和非常满意的居民均很少。仅有12.5%的服务项目利用率高于60%。结论:整体来说中部经济欠发达地区农村基本公共卫生服务开展利用情况不理想,需要提高重视,采取措施以提高农村基本公共卫生服务水平。",基本公共卫生服务;农村卫生;卫生服务利用;
我国基本公共卫生服务均等化实践的PEST分析,刘小涛;马颖;陈任;方桂霞;胡志;秦侠,中国卫生事业管理(2016年08期),2016/8/15,"促进基本公共卫生服务均等化是我国新医改重点工作之一。文章采用PEST分析方法对我国基本公共卫生服务均等化的政治、经济、社会和技术环境进行深入分析,以期为推进我国基本公共卫生服务均等化提供参考。",基本公共卫生服务;均等化;PEST;
基层基本公共卫生服务和卫生监督执法的实践及解释――以滇中S镇为例,陈柏峰;刘杨,湖北社会科学(2016年08期),2016/8/10,"在当前基层公共卫生服务和卫生监督执法的良好贯彻过程中,兼具行政性和半行政性的基层政策执行组织体系的建立与运转发挥了基础性的作用,这体现了国家能力的发展。但基层公共卫生服务和卫生监督执法工作中仍然存在的实践困境,则体现了当前国家能力的限度和缺陷。国家能力的发展,离不开规范体系的建立和推行,也离不开基层相关职能部门的组织建设和有效运转。对于当前的中国而言,在国家能力发展走向多元、深入社会的进程中,组织体系的完善和运转是一个更为切实和紧迫的问题。特别在我国已经建成中国特色社会主义法律体系的情况下,要想在基层社会贯彻落实相关法律规范(包括公共政策),就必须着力完善基层政策执行组织体系的构成与实践。",公共卫生服务;卫生监督执法;国家能力;
2014年重庆市基本公共卫生服务项目效率分析,王鹏;杨弦弦;周锡鹏;薛健;彭斌;胡彬;尹岭;邱景富,上海交通大学学报(医学版)(2016年07期),2016/7/28,"目的测算2014年重庆市各区县基本公共卫生服务项目的服务效率,为今后的项目实施提供参考。方法以全市所有区县为评价对象,运用数据包络分析(DEA)对样本区县的综合效率、纯技术效率和规模效率进行测算。结果2014年重庆市基本公共卫生服务项目综合效率平均值为0.800,纯技术效率平均值为0.890,规模效率平均值为0.899;15个区县DEA有效,20个区县DEA无效;其中11个区县为规模效率递减,9个区县为规模效率递增。结论重庆市基本公共卫生服务项目效率尚待进一步提高,各功能区之间发展不均衡,需要加强资金分配与人才流动的灵活性,提高资源利用效率及产出指标。",数据包络分析;基本公共卫生服务;效率;
促进我国流动人口基本公共卫生服务均等化的筹资机制研究,段丁强;应亚珍;周靖,人口与经济(2016年04期),2016/7/25,"从筹资的角度分析制约我国地方政府向流动人口均等化供给基本公共卫生服务的原因,总结国外流动人口基本公共卫生服务筹资的经验,提出筹资机制改革建议。研究结果表明:我国现行的以常住人口为基数核定和安排基本公共卫生服务筹资责任的政策安排,给地方政府回避流动人口基本公共卫生服务的供给责任提供了制度空间,导致了流动人口公共卫生服务筹资""两头落空""的现象,影响了服务供给的均等化水平。我国须进一步强化中央政府的投入责任,保证流动人口基本公共卫生服务筹资的总体充足性,同时完善转移支付制度,增加对人口流入地的基本公共卫生服务经费补助金额,从而填补短期流动人口筹资政策的空白。",流动人口;基本公共卫生服务;均等化;筹资机制;
